_id,username,word,emoji,hastag,len_word,len_emoji,len_hastag,len_emotion
5ed04aa4682cbc70de4c517e,VanDykInsurance,"upon, kick, sure, follow, safety, tip, enjoy, waterway, remember, offer, boat, recreational, vehicle, let, help, protect, investment, enjoy, water, year, come",0,"['#MemorialDayWeekend', '#Summer2020', '#insurance']",21,0,3,6
5ed04aa4682cbc70de4c517f,VanDykInsurance,"tomorrow, sit, outside, get, vitamin, bee, check, live, talk, hear, wasp, buzz",0,"['#localhoney', '#murderhornets', '#honeybees', '#theplacetobeLBT']",12,0,4,5
5ed04aa4682cbc70de4c5180,VanDykInsurance,"today, say, dedication, sacrifice, compassion, today, every, single, day",0,"['#ThankYouNurses', '#HealthcareHeroes', '#SuperHero', '#NursesDay2020', '#WednesdayThoughts', '#ThankANurse']",9,0,6,3
5ed04aa4682cbc70de4c5181,VanDykInsurance,"either, flight, path, sure, step, outside, take, look, remember, follow, protocol",0,"['#StayAtHome', '#Thunderbirds', '#BlueAngels', '#AmericaStrong']",11,0,4,2
5ed04aa4682cbc70de4c5182,VanDykInsurance,"today, favourite, fave, author, prefer, fiction, non, fiction, reading, quarantine, share, title",0,"['#worldbookday2020', '#COVID19', '#WorldBookDay', '#Read', '#booksareessential', '#StayAtHome']",12,0,6,5
5ed04aa4682cbc70de4c5183,VanDykInsurance,"fellow, small, business, owner, fbi",0,"['#SmallBusiness', '#SmallBiz', '#PPPloan', '#localbusiness', '#insurance', '#COVID19', '#COVID19relief']",5,0,7,1
5ed04aa4682cbc70de4c5184,VanDykInsurance,"let, join, campaign, show, family, friend, neighbor, elderly, community, much, care",0,"['#EverydayActsOfCare', '#TogetherApart', '#TogetherAtHome', '#TogetherWeCan', '#togetherwerise', '#community', '#LocalPride', '#LocalHeroes']",11,0,8,4
5ed04aa4682cbc70de4c5185,VanDykInsurance,"please, stay, aware, vigilant, today",0,0,5,0,0,1
5ed04aa4682cbc70de4c5186,VanDykInsurance,"announced, customer, watch, credit, account, work, together, help, customer",0,0,9,0,0,5
5ed04aa4682cbc70de4c5187,VanDykInsurance,"beach, close, except, resident, emergency, placard, must, carry, placard, limited, walk, jog, beach, chair, lay, beach, adult, minor, child, allow, dog, leash",0,['#FlattenTheCurve'],22,0,1,8
5ed04aa6682cbc70de4c518a,CMP_4U,"police, officer, leigh, look, naughty, boys, join, page, get, free, naughty, join, video",0,0,13,0,0,3
5ed04aa6682cbc70de4c518b,CMP_4U,"adult, content, creator, adult, video, producer, cam, star, asian, fantasy, come, experience, excitement","arrow, right",0,13,2,0,4
5ed04aa6682cbc70de4c518c,CMP_4U,"let, give, kiss, bed","kiss, a, face, blowing",0,4,4,0,1
5ed04aa6682cbc70de4c518d,CMP_4U,"throwback, thursday","heart, yellow",0,2,2,0,0
5ed04aa6682cbc70de4c518e,CMP_4U,"welcome, guy","suit, heart",0,2,2,0,0
5ed04aa6682cbc70de4c518f,CMP_4U,"latin, sexy, line",0,0,3,0,0,0
5ed04aa6682cbc70de4c5190,CMP_4U,"ready, steady, come, catch","with, face, heart, horns, blue, smiling",['#Online'],4,6,1,3
5ed04aa6682cbc70de4c5191,CMP_4U,"online, tip, show, free, video, put, see, whiteboard, public, show, hero, win, prize",0,"['#MyFreeCams', '#LIVEonCAM', '#MFCModel']",13,0,3,7
5ed04aa6682cbc70de4c5192,CMP_4U,"new, video",0,0,2,0,0,0
5ed04aa7682cbc70de4c5194,allhaleanna,"sign, petition, demand, police, officer, involve, murdered, george, floyd, arrest, charge, immediately",0,['#BlackLivesMatter'],12,0,1,4
5ed04aa7682cbc70de4c5195,allhaleanna,xxx,"heart, red",0,1,2,0,1
5ed04aa7682cbc70de4c5196,allhaleanna,"want, cry, heartbroken, company, crew, involve, terrified, future, consistently, disappointed, government",0,0,11,0,0,5
5ed04aa7682cbc70de4c5197,allhaleanna,"huge, thank, robyn, olivia, support, young, company, young, company, last, week, company, member, inspire, puppetry, sing, workshop, eager, use, new, skill, across, rest, term",0,['#PlayhouseAtHome'],24,0,1,6
5ed04aa7682cbc70de4c5198,allhaleanna,"happy, national, child, week, celebrate, get, two, competition, keep, kid, entertain, check, info",eyes,['#Gardening'],13,1,1,7
5ed04aa7682cbc70de4c5199,allhaleanna,"absolutely, unless, unless, make, trip, test, eyesight",0,0,7,0,0,1
5ed04aa7682cbc70de4c519a,allhaleanna,"guy, get, wrong, put, life, risk, put, life, risk",0,0,9,0,0,4
5ed04aa7682cbc70de4c519b,allhaleanna,"drive, test, first, requirement, even, switch, engine, eyesight, test, eyesight, legal, standard, glass, contact, necessary, fail, test, test, eyesight, drive, bit, check, work",0,0,23,0,0,1
5ed04aa7682cbc70de4c519c,allhaleanna,write,0,0,1,0,0,0
5ed04aa7682cbc70de4c519d,allhaleanna,"forget, tell, journalist, cummings, isolate, london",0,0,6,0,0,1
5ed04aab682cbc70de4c51aa,EmTSuss,"talked, importance, politics, intersection, culture, panel, hear, whole, conversation, panel, premiere, friday, est",0,['#XYZSummit'],13,0,1,3
5ed04aab682cbc70de4c51ab,EmTSuss,"hear, activism, run, office, panel, premiere, friday, est",0,['#XYZSummit'],8,0,1,2
5ed04aab682cbc70de4c51ac,EmTSuss,"think, hop, quick, recovery",bouquet,0,4,1,0,1
5ed04aab682cbc70de4c51ad,EmTSuss,"ici, team, bring, special, conversation, senator, tune, hear, leadership, time, crisis, policy, need, response, election",0,"['#YourPrimaryPlaylist', '#XYZSummit', '#coronavirus']",15,0,3,5
5ed04aab682cbc70de4c51ae,EmTSuss,"proud, friend, precast, precast, uplifting, conversation, listen, feel, little, good, understand, build, equitable, society, crisis",0,"['#YourPrimaryPlaylist', '#XYZSummit']",15,0,2,5
5ed04aab682cbc70de4c51af,EmTSuss,"need, progress, return, normal, sat, talk, pandemic, inequity, expose, current, system, hear, whole, conversation",0,"['#XYZSummit', '#YourPrimaryPlaylist', '#coronavirus']",14,0,3,4
5ed04aab682cbc70de4c51b0,EmTSuss,"dont, miss, todays, special, episode, senator, booker, ovid, election, moreton, miss, listen",0,['#YourPrimaryPlaylist'],12,0,1,3
5ed04aab682cbc70de4c51b1,EmTSuss,"dont, want, normal, want, progress, speak, senator, systemic, inequity, highlight, pandemic, much, new, bonus, episode",0,"['#coronavirus', '#2020Elections', '#XYZSummit']",15,0,3,3
5ed04aab682cbc70de4c51b2,EmTSuss,"proud, friend, senator, chief, staff, selflessness, commitment, help, others, always, check, profile",0,0,12,0,0,3
5ed04aab682cbc70de4c51b3,EmTSuss,"dont, want, country, back, normal, ovid, want, country, well, make, progress, systemic, inequity, virus, expose",0,['#XYZSummit'],15,0,1,2
5ed04aac682cbc70de4c51b5,DomestikaEn,"whats, favorite, film, soundtrack, ask, domestic, community, favorite, film, music, sound, design, top, nomination","board, clapper",0,14,2,0,4
5ed04aac682cbc70de4c51b6,DomestikaEn,"new, course, ever, felt, moved, walk, city, compel, express, make, feel, learn, depict, cityscape, use, digital, analog, illustration, technique, artist, architect",fire,0,21,1,0,0
5ed04aac682cbc70de4c51b7,DomestikaEn,"get, sketchbook, ready, start, draw, prompt, share, online, use",pencil,['#MattiasAdolfssonxDomestika'],9,1,1,3
5ed04aac682cbc70de4c51b8,DomestikaEn,"yes, click, list, find, title, course, course, presentation, page, create, new, list, view, click, profile, picture, view, profile, list","winking, face",0,19,2,0,2
5ed04aac682cbc70de4c51b9,DomestikaEn,"finally, decide, purchase, online, draw, class, hone, skills, good, teacher",0,0,10,0,0,3
5ed04aac682cbc70de4c51bb,DomestikaEn,"celebrate, week, gather, best, course, develop, geek, potential",0,['#GeekPrideDay'],8,0,1,2
5ed04aac682cbc70de4c51bc,DomestikaEn,"great, brush, digital, painting",0,0,4,0,0,0
5ed04aac682cbc70de4c51bd,DomestikaEn,"color, illustration, use, flattening, technique",0,0,5,0,0,0
5ed04aac682cbc70de4c51be,DomestikaEn,"way, save, image",0,0,3,0,0,1
5ed04aae682cbc70de4c51c0,nora_lafarga,"ridiculous, see, twitter, try, make, case, mail, ballot, subject, fraud, stupid, example, case, place, election, process, become, badly, tainted, laughing-stock, world, tell, hater",0,0,23,0,0,7
5ed04aae682cbc70de4c51c1,nora_lafarga,"parler, everything, twitter, int, free, literally, free, free, thought, think, police, parler, sign, today",fire,0,14,1,0,5
5ed04aae682cbc70de4c51c2,nora_lafarga,"thursday, may, barak, ibama, corrupt, president, history, thanks, good, day",0,['#Obamagate'],10,0,1,2
5ed04aae682cbc70de4c51c3,nora_lafarga,"big, day, social, medium, fairness",0,0,5,0,0,0
5ed04aae682cbc70de4c51c4,nora_lafarga,"joe, lose, black, vote, stupid, comment, youse, lose, latino, vote, gaff, latinos, dont, like, call, latin","down, index, backhand, pointing",['#VoteRedToSaveAmerica'],16,4,1,6
5ed04aae682cbc70de4c51c5,nora_lafarga,"blame, nursing, home, obey, order",0,0,5,0,0,3
5ed04aae682cbc70de4c51c6,nora_lafarga,"jerry, sadler, paper, ballot, extremely, susceptible, fraud, show, experience, would, make, head, spin",0,0,13,0,0,4
5ed04aae682cbc70de4c51c7,nora_lafarga,"remember, laura, loom, blast, jack, dorsey, censor, conservative, mock, republican, try, talk, mock",0,0,13,0,0,3
5ed04aae682cbc70de4c51c8,nora_lafarga,"local, astronaut, prepare, historic, launch",0,0,5,0,0,2
5ed04aae682cbc70de4c51c9,nora_lafarga,"sure, kathy, griffin, defend, advocate, stab, trump, syringe, fill, air, hey, kathy, griffin, disgust, sweet, violate, policy",0,0,17,0,0,9
5ed04ab1682cbc70de4c51cb,iosolofede,"loudly, people, back, local, election, impact, life, police, depts, sheriff, office, answer, mayor, council, county, official, elect, want, value, reflect, public, servant, run, office, help, someone, get, elect, god, sake, vote",0,0,31,0,0,14
5ed04ab1682cbc70de4c51cc,iosolofede,"colorado, mail, ballot, every, frigging, election, fight, chase, darn, kid, street, steal, ballot, get, old, shit",0,0,16,0,0,7
5ed04ab1682cbc70de4c51cd,iosolofede,"vocabulary, level, reach, grade, emotional, level, reach, really, care, say",0,0,10,0,0,3
5ed04ab1682cbc70de4c51ce,iosolofede,risk,0,0,1,0,0,1
5ed04ab1682cbc70de4c51cf,iosolofede,"thank, glad, speak, confuse, understand, heard, call, low, poll, possible, backlash, service, men, woman, number, reelection, always, priority",0,0,18,0,0,3
5ed04ab1682cbc70de4c51d0,iosolofede,"trump, please, get, presidency, annul",0,0,5,0,0,1
5ed04ab1682cbc70de4c51d1,iosolofede,sign,0,0,1,0,0,0
5ed04ab1682cbc70de4c51d2,iosolofede,country,0,['#3HOTSANDACOT'],1,0,1,0
5ed04ab1682cbc70de4c51d3,iosolofede,"problem, think, national, anthem, flag, represent, military, soldier, since, military, get, appropriate, propagandist, message, belong, symbol, people, one, die, song, flag",0,0,21,0,0,5
5ed04ab1682cbc70de4c51d4,iosolofede,"later, still, cant, tell, solution, hot, shit, genius, soon, much, say, black, people, hella, surprising, answer, cant, protest, cant, riot, cant, kneel",0,0,22,0,0,5
5ed04ab2682cbc70de4c51d7,Tonobouy,"break, premier, league, officially, restart, june, start, aston, villa, sheffield, united, manchester, city, arsenal, finally, football, fan, right","hands, raising",0,18,2,0,5
5ed04ab2682cbc70de4c51d8,Tonobouy,"club, plan, pre, season, friendly, premier, league, side, ahead, match, resume, championship, side, also, explore, idea, warm, match, try, schedule, game, premier, league, club",0,0,24,0,0,4
5ed04ab2682cbc70de4c51d9,Tonobouy,"break, premier, league, club, agree, june, restart, date",0,0,8,0,0,2
5ed04ab2682cbc70de4c51da,Tonobouy,"human, planet, nowhere, else","face, crying",['#BlackLivesMatter'],4,2,1,0
5ed04ab2682cbc70de4c51db,Tonobouy,america,0,0,1,0,0,0
5ed04ab2682cbc70de4c51dc,Tonobouy,"control, pep, lender","with, heart-eyes, face, smiling",0,3,4,0,1
5ed04ab2682cbc70de4c51dd,Tonobouy,"premier, league, shareholder, today, vote, unanimously, resume, contact, training, mark, another, step, towards, restart, premier, league, season, safe, full, statement",0,0,20,0,0,4
5ed04ab2682cbc70de4c51de,Tonobouy,"hit, still, one, best, thing, ever, happen, nigmusic, industry, give, good, music, think, carry, brother, along, even, never, come, back, together, still, say, thanks, jazzy, bang, rest, team, motivate",0,0,29,0,0,9
5ed04ab2682cbc70de4c51df,Tonobouy,"put, smile, face, matter, condition, fein",0,0,6,0,0,2
5ed04ab3682cbc70de4c51e2,JohnMartini3,"pure, buddhist, song, guanine, heal, mantra, best, relax, buddhist, music, great, compassion, mantra, name, gun, shi, yin, bodhisattva",0,"['#NYC', '#Brooklyn', '#Queens', '#Bronx', '#StatenIsland', '#Buddhism', '#Buddha', '#Dharma', '#thursday', '#Nirvana', '#BuddhaNature', '#Music', '#ChineseMusic']",18,0,13,8
5ed04ab3682cbc70de4c51e3,JohnMartini3,"art, let, daily, life, dharma, drum",0,"['#NYC', '#Brooklyn', '#Queens', '#Bronx', '#StatenIsland', '#Buddhism', '#Buddha', '#Dharma', '#thursday', '#Spiritual', '#Suffering', '#Nirvana', '#BuddhaNature']",6,0,13,3
5ed04ab3682cbc70de4c51e4,JohnMartini3,"meet, adversity, joy, corner, sravasti, abbey",0,"['#NYC', '#Brooklyn', '#Queens', '#Bronx', '#StatenIsland', '#Buddhism', '#Buddha', '#Dharma', '#thursday', '#Spiritual', '#Suffering', '#Nirvana', '#BuddhaNature']",6,0,13,2
5ed04ab3682cbc70de4c51e5,JohnMartini3,"open, window, theguzheng, shop",0,"['#NYC', '#Brooklyn', '#Queens', '#Bronx', '#StatenIsland', '#Buddhism', '#Buddha', '#Dharma', '#thursday', '#Spiritual', '#Suffering', '#COVID19', '#pandemic', '#Nirvana', '#BuddhaNature', '#Music', '#ChineseMusic']",4,0,17,0
5ed04ab3682cbc70de4c51e6,JohnMartini3,"body, die, jahn, nissarano",0,"['#NYC', '#Brooklyn', '#Queens', '#Bronx', '#StatenIsland', '#Buddhism', '#Buddha', '#Dharma', '#thursdaymorning', '#Spiritual', '#Suffering', '#COVID19', '#pandemic', '#Nirvana', '#BuddhaNature']",4,0,15,1
5ed04ab3682cbc70de4c51e7,JohnMartini3,"body, die, jahn, nissarano",0,"['#NYC', '#Brooklyn', '#Queens', '#Bronx', '#StatenIsland', '#Buddhism', '#Buddha', '#Dharma', '#thursdaymorning', '#Spiritual', '#Suffering', '#COVID19', '#pandemic', '#Nirvana', '#BuddhaNature']",4,0,15,1
5ed04ab3682cbc70de4c51e8,JohnMartini3,"buddha, chant, gushing, shop",0,"['#NYC', '#Brooklyn', '#Queens', '#Bronx', '#StatenIsland', '#Buddhism', '#Buddha', '#Dharma', '#thursday', '#Spiritual', '#Suffering', '#COVID19', '#pandemic', '#Nirvana', '#BuddhaNature', '#Music', '#ChineseMusic']",4,0,17,2
5ed04ab4682cbc70de4c51e9,JohnMartini3,"buddhist, language, dharma, dhamma, mind, lee, kumar, enthusiastic, buddhist",0,"['#NYC', '#Brooklyn', '#Queens', '#Bronx', '#StatenIsland', '#Buddhism', '#Buddha', '#Dharma', '#thursdaymorning', '#Spiritual', '#Suffering', '#COVID19', '#pandemic', '#Nirvana', '#BuddhaNature']",9,0,15,4
5ed04ab4682cbc70de4c51ea,JohnMartini3,"foundation, buddhist, practice, dharma, help, death",0,"['#NYC', '#Brooklyn', '#Queens', '#Bronx', '#StatenIsland', '#Buddhism', '#Buddha', '#Dharma', '#thursdaymorning', '#Spiritual', '#Suffering', '#COVID19', '#pandemic', '#Nirvana', '#BuddhaNature']",6,0,15,3
5ed04ab5682cbc70de4c51ec,happyeggshaped,"lady, gentleman, please, welcome, gittins, cant, wait, see, stash, happiness, egg, shape",0,"['#FavouriteSocialNetwork', '#CreateHope']",12,0,2,3
5ed04ab5682cbc70de4c51ed,happyeggshaped,"classic, even, scotton, watch, glasgow, warrior, edinburgh, casebook, couture, sunday, power","crossed, videocassette, swords",['#WarriorsReloaded'],11,3,1,3
5ed04ab5682cbc70de4c51ee,happyeggshaped,"message, gregor, townsend",memo,['#AsOne'],3,1,1,0
5ed04ab5682cbc70de4c51ef,happyeggshaped,"another, week, win, quiz","tears, joy, with, of, face, hands, raising","['#quizmaster', '#RP7s', '#WinnerWinner']",4,7,3,1
5ed04ab5682cbc70de4c51f0,happyeggshaped,"havent, move, far, time, old, anniesland, new, anniesland",0,0,8,0,0,1
5ed04ab5682cbc70de4c51f1,happyeggshaped,"thread, brace, award, star, man, fly, half, richie, simpson, pick, player, year, player, player, year","hands, trophy, clapping",['#MillbraeMade'],15,3,1,2
5ed04ab5682cbc70de4c51f2,happyeggshaped,"insightful, discussion, talent, development, even, current, selection, coach, scout, german, football, federation, tobias, scholes, interest, hear, approach, listen, late, episode","down, index, backhand, pointing",0,20,4,0,3
5ed04ab5682cbc70de4c51f3,happyeggshaped,"thread, final, award, even, senior, rugby, academy, head, coach, frazier, climb, name, two, men, player, year, congratulation, captain, michael, lafferty, aiden, connor",trophy,['#MillbraeMade'],22,1,1,2
5ed04ab5682cbc70de4c51f4,happyeggshaped,"party, int, famous, fabulous, rugby, club, also, decent, beach, sunny, weekend, approach, please, adhere, advice, give, scottish, government, respect, key, worker",0,0,21,0,0,8
5ed04ab5682cbc70de4c51f5,happyeggshaped,"feel, great, body, feel, good, aerobically, fitness, wise, pretty, much, brad, weber, talk, derby, lead, invest, aotearoa, full, story","arrow, right",0,19,2,0,4
5ed04ab6682cbc70de4c51f7,fladog82,"rob, green, turn, troll",0,0,4,0,0,4
5ed04ab6682cbc70de4c51f8,fladog82,love,0,0,1,0,0,1
5ed04ab6682cbc70de4c51f9,fladog82,"best, dressed, guy, house",0,0,4,0,0,0
5ed04ab6682cbc70de4c51fa,fladog82,"foal, loretta, bbc","light, finger, middle, tone, skin",0,3,5,0,0
5ed04ab6682cbc70de4c51fb,fladog82,"ive, buy, clothes, ive, ever, buy, last, month",0,0,8,0,0,0
5ed04ab6682cbc70de4c51fc,fladog82,"bessie, say, want, pet, snake, nope",0,0,6,0,0,1
5ed04ab6682cbc70de4c51fd,fladog82,"look, like, jesus, thats, hes, magical",0,0,6,0,0,3
5ed04ab6682cbc70de4c51fe,fladog82,"labour, supporter, every, time, government, make, mistake, knockdown",0,0,8,0,0,4
5ed04ab6682cbc70de4c5200,fladog82,"total, bielsaball","blue, heart",0,2,2,0,0
5ed04ab8682cbc70de4c5202,kojo_jhase,"alice, annul, ghana, sensational, female, sprinter, tag, baby, jet, due, remarkable, speed, gold, africa, game, long, jump, brazzaville, pull, three, consecutive, olympic, game",0,0,23,0,0,5
5ed04ab8682cbc70de4c5203,kojo_jhase,"say, voted, worth, win, artiste, year, felt, horrible, system, charlie",0,0,10,0,0,3
5ed04ab8682cbc70de4c5204,kojo_jhase,"open, business, visit, shop, ebony, lane, tashie, fungus, estate, call, delivery, service, also, available, fee","with, eyes, face, smiling",0,15,4,0,4
5ed04ab8682cbc70de4c5205,kojo_jhase,"fulham, striker, pavel, pogrebnyak, hospitalise, pneumonia, contract, coronavirus, wife, three, son, also, disease",0,0,13,0,0,2
5ed04ab8682cbc70de4c5206,kojo_jhase,"true, fellowshipper, reflect, love, god, relationship, brother, john",0,"['#MondayMotivation', '#ExcellingInTheWordOfGod', '#YearOfExcellence', '#StaySafe', '#HarvestIsHome']",8,0,5,5
5ed04ab8682cbc70de4c5207,kojo_jhase,"bee, dey, mad",0,0,3,0,0,2
5ed04ab8682cbc70de4c5208,kojo_jhase,"new, post, hong, kong, police, fire, teargas, citizen, protest, china, propose, security, law, publish, monte, live",0,0,16,0,0,4
5ed04ab8682cbc70de4c5209,kojo_jhase,"thank, abba, father","star, hands, folded, glowing",0,3,4,0,1
5ed04ab8682cbc70de4c520a,kojo_jhase,"people, break, spend, million, perception, lamb, phillips, reveals, extent, people, live, fake, life",0,0,13,0,0,4
5ed04ab8682cbc70de4c520b,kojo_jhase,"kid, say, cheese",0,"['#Urbanroll', '#ghana', '#staysafe']",3,0,3,1
5ed04aba682cbc70de4c520d,JustinKernoghan,"tonight, last, clap, nhs, key, worker, outside, belfast, mater, hospital",0,"['#lockdown2020', '#belfast', '#SocialDistancing', '#CoronaUpdate', '#covid19UK', '#COVID19', '#staysafe', '#StayAtHomeAndStaySafe', '#NHSclap', '#NHSheroes', '#NHSThankYou']",10,0,11,2
5ed04aba682cbc70de4c520e,JustinKernoghan,"tonight, last, clap, nhs, key, worker, outside, belfast, mater, hospital",0,"['#lockdown2020', '#belfast', '#SocialDistancing', '#CoronaUpdate', '#covid19UK', '#COVID19', '#staysafe', '#StayAtHomeAndStaySafe', '#StayHomeSaveLives', '#NHSclap', '#NHSheroes', '#NHSThankYou']",10,0,12,2
5ed04aba682cbc70de4c520f,JustinKernoghan,"great, recovery, well, rescue, package, ulster, fish, farm, minister, edwin, boot, visit, movanagher, fish, farm",0,"['#movanagherfishfarm', '#fishing', '#COVID__19', '#coronavirus']",15,0,4,4
5ed04aba682cbc70de4c5210,JustinKernoghan,"drive, service, dunseverick, baptist, church",0,"['#drivein', '#Church', '#lockdown2020', '#belfast', '#SocialDistancing', '#CoronaUpdate', '#covid19UK', '#COVID19', '#staysafe', '#StayAtHomeAndStaySafe', '#StayHomeSaveLives']",5,0,11,2
5ed04aba682cbc70de4c5211,JustinKernoghan,"ease, knockdown, restriction, northwest, causeway, coast",0,"['#lockdown2020', '#belfast', '#SocialDistancing', '#CoronaUpdate', '#covid19UK', '#COVID19', '#staysafe', '#StayAtHomeAndStaySafe', '#StayHomeSaveLives']",6,0,9,2
5ed04aba682cbc70de4c5212,JustinKernoghan,"ice, screen, van",0,"['#lockdown2020', '#belfast', '#SocialDistancing', '#CoronaUpdate', '#covid19UK', '#COVID19', '#staysafe', '#StayAtHomeAndStaySafe', '#StayHomeSaveLives', '#icecream', '#icecreamvan']",3,0,11,0
5ed04aba682cbc70de4c5213,JustinKernoghan,"belfast, care, home, release, balloon, memory, resident, sadly, die, ovid, crisis",0,"['#lockdown2020', '#belfast', '#SocialDistancing', '#CoronaUpdate', '#covid19UK', '#COVID19', '#staysafe', '#StayAtHomeAndStaySafe', '#StayHomeSaveLives']",11,0,9,4
5ed04aba682cbc70de4c5214,JustinKernoghan,"clonard, monastery, reopens",0,"['#lockdown2020', '#belfast', '#SocialDistancing', '#CoronaUpdate', '#covid19UK', '#COVID19', '#staysafe', '#StayAtHomeAndStaySafe', '#StayHomeSaveLives']",3,0,9,0
5ed04aba682cbc70de4c5215,JustinKernoghan,"first, minister, arlene, foster, dara, minister, edwin, boot, visit, hollowbridge, diary, farm, welcome, support, beef, dairy, sector",0,"['#Covid_19', '#hollowbridgeicecream']",17,0,2,2
5ed04aba682cbc70de4c5216,JustinKernoghan,"love, andorra, great, spot, luckily, week, knockdown, well","up, thumbs",0,8,2,0,1
5ed04abb682cbc70de4c5218,MGAdining,"happy, pay, forward, day, make, living, get, make, life, give, winston, churchill, middle, georgia, state, university","heart, red","['#SodexoPaysItForward', '#Love', '#Kindness']",16,2,3,5
5ed04abb682cbc70de4c5219,MGAdining,"let, make, world, kinder, place, knightsdining","Americas, eyes, with, face, globe, showing, gift, smiling, wrapped",['#SodexoPaysItForward'],6,9,1,0
5ed04abb682cbc70de4c521a,MGAdining,leave,"with, meridians, heart, folded, globe, gift, hands, red, wrapped","['#SodexoPaysItForward', '#pifdayusa']",1,9,2,1
5ed04abb682cbc70de4c521b,MGAdining,"join, pay, forward, kind, act, small, initiative, exists, make, difference, create, huge, ripple, kindness, felt, across, world, leave, your","Americas, heart, globe, showing, gift, red, wrapped","['#PayItForwardDay', '#pifdayusa', '#SodexoPaysItForward']",19,7,3,5
5ed04abb682cbc70de4c521c,MGAdining,"plan, schedule, meal, snack, throughout, day, minimize, trip, grocery, store",0,"['#TipoftheDay', '#motivation', '#motivationmonday', '#snacks', '#mindfulness', '#positivethinking', '#stayathome', '#remotework', '#knightsdining', '#MiddleGeorgiaState', '#MGAStateU']",10,0,11,3
5ed04abb682cbc70de4c521d,MGAdining,"april, want, know, home, community, support, planet, comment, tag, awesome, thing",0,"['#EarthMonth', '#MyGreenIdea', '#MiddleGa', '#MGAState']",11,0,4,1
5ed04abb682cbc70de4c521e,MGAdining,"hey, experiment, kitchen, take, walnut, bread, pudding, warm, vanilla, sauce, share, favorite, meal, creation, always, look, new, tasty, trend","woman, cooking","['#food', '#knightsdining', '#mgaknights']",19,2,3,4
5ed04abb682cbc70de4c521f,MGAdining,"faculty, staff, student, play, bingo, chance, win, merchandise, get, diagonal, across, post, picture, win, card, use, follow",0,"['#MGAStateU', '#MGADining', '#Sodexo', '#bingo', '#MGADiningBingo']",17,0,5,6
5ed04abb682cbc70de4c5220,MGAdining,"ready, set, challenge, core, hold, challenge, home",0,"['#Mindful', '#TrySomethingNew', '#SodexoUniversities']",7,0,3,4
5ed04abb682cbc70de4c5221,MGAdining,"really, miss, student, let, stay, connect, social, medium, keep, service, event, delicious, meal, easy, recipe, drop, say, share, favorite, story, hear","heart-eyes, fingers, splayed, raised, with, face, hand, smiling","['#KnightsDining', '#sostories', '#MGAKnights']",21,8,3,5
5ed04abd682cbc70de4c5223,BryanBarclay,"bayern, beat, dortmund, easily",0,0,4,0,0,0
5ed04abd682cbc70de4c5224,BryanBarclay,"create, couture, channel, late, way, share, content, journey, back, restart, programme, begin, comeback, strong, setback","black, flag, ball, soccer","['#ForzaJuve', '#JuventusAcademyScotland', '#GetReadyToComeback']",15,4,3,7
5ed04abd682cbc70de4c5225,BryanBarclay,"highlight, week, course, superb, start, finish, plenty, discussion, insight, number, field, related, game","ball, soccer",0,13,2,0,4
5ed04abd682cbc70de4c5226,BryanBarclay,"really, enjoy, seminar, tonight, like, champion, league, table, idea, promote, competition, amongst, squad","ball, soccer",0,13,2,0,4
5ed04abd682cbc70de4c5227,BryanBarclay,"cheer, chris, far, good, hope, well","light, thumbs, tone, skin, up",0,6,5,0,3
5ed04abd682cbc70de4c5228,BryanBarclay,"really, excited, start, next, part, coach, journey, tomorrow","ball, soccer",0,8,2,0,5
5ed04abd682cbc70de4c5229,BryanBarclay,"sky, cinema, definitely, worth, watch","light, thumbs, tone, skin, up",0,5,5,0,1
5ed04abd682cbc70de4c522a,BryanBarclay,"kobe, bryant, muse, really, enjoy, similar, last, dance, mentality, win, show, kobe, bryant, michael, jordan, unparalleled","light, clapping, tone, skin, hands",0,16,5,0,4
5ed04abd682cbc70de4c522b,BryanBarclay,"monday, morning, one, thing",basketball,0,4,1,0,1
5ed04abd682cbc70de4c522c,BryanBarclay,"late, skill, practice, spin, use, inside, foot, cut, shield, ball, challenge, diagonally, side, quickly, cut, ball, foot, keep, turn, twist, space, keep, practising","black, flag, ball, soccer",['#StayAtHome'],23,4,1,3
5ed04abe682cbc70de4c522e,IntelRegion,"twitter, android, user, happy, see, one, wicked",0,0,7,0,0,2
5ed04abe682cbc70de4c522f,IntelRegion,"twitter, android, user, happy, see, one, wicked",0,0,7,0,0,2
5ed04abe682cbc70de4c5230,IntelRegion,"hit, record, still, one, best, happen, nigeria, music, industry, olavide",0,"['#olamide', '#nysc']",10,0,2,3
5ed04abe682cbc70de4c5231,IntelRegion,"hit, record, still, one, best, happen, nigeria, music, industry, olavide",0,"['#olamide', '#nysc']",10,0,2,3
5ed04abe682cbc70de4c5232,IntelRegion,"billionaire, emi, otedola, remind, daughter, admirer, boyfriend",0,"['#otedola', '#nysc']",7,0,2,2
